id,nombre,tipo,rol,quirk,vinculo,nivel,regimen,relevancia,estado
todoroki-001,Todoroki Shoto,1-A,amigo (vínculo masculino PRINCIPAL),Half-Cold Half-Hot,amistad,7,anclado,alta,"S1-S3: cuerda tendida, bebidas silenciosas, se abre despacio; charla del fuego al amanecer (el coste de 'media alma'). Nivel ~5. S4/D4: VINO ÉL a preguntar si son amigos; PACTO RECÍPROCO de los muros + apretón de mano de hielo DELANTE de la clase + 'en ti empiezo a confiar'. >>> SUBIÓ 5→7 y se ANCLÓ (hito de sinceridad de amistad). El mayor salto de vínculo masculino de la campaña. Mesa de los guardianes."
midoriya-001,Midoriya Izuku,1-A,amigo,One For All (daña al usuario),amistad,5,volátil,alta,"S1: alianza 'Quirks que duelen'. S4/D4: mesa de los guardianes; conmovido por la identidad de 'guardianes'; te 'investiga' ('conexión anómala'). S9/D9 (tras Fundamentos con All Might): DECIDIÓ dejar de investigarle y empezar a CONOCERLE ('no quiero ser el tío que te estudia, quiero cubrirte las espaldas; si algún día quieres contarme cómo funciona, te escucho; y si no, también'). PACTO: 'ENTRENEMOS JUNTOS' → 'Trato hecho, Hayami' ('Quirks que duelen', como el 1er día — los dos cargan un Quirk que hace daño/pesa). Sigue siendo fanboy de All Might. Nivel 5→ amistad más sólida (compromiso de entreno conjunto pendiente de agendar). S11/D12 (escolta a ciegas): 3 páginas del cuaderno nº14 sobre la escolta de Akari; decidió pedirle clases de porteo de heridos ('carga a la gente como si el mundo fuera de cristal'); vio a Kacchan elegir objetivo."
kaminari-001,Kaminari Denki,1-A,amigo (Bakusquad),Electrification,amistad,5,volátil,media,"S2: lealtad sellada; te mete en el Bakusquad. S6/D5 (izakaya): 4→5 — Akari le dio una vía de crecimiento del Quirk (absorber energía externa en vez de solo descargar y apagarse; equipo de soporte Sero/Kirishima/Momo) y lo trató como amigo de verdad ('te debo una gorda'). NOTA: tuvo un lío pasado y MUERTO con Mina (Akari lo sabe por ella; no lo hace raro, lo protege)."
tokoyami-001,Tokoyami Fumikage (Tsukuyomi),1-A,hermano de armas,Dark Shadow,amistad,6,anclado,media-alta,"S2: hermandad metalera sellada (ancla). S4/D4: pilar de la mesa de los GUARDIANES; da nombre épico a cada guardián. Nivel 6, anclado por la hermandad metalera. S11/D12 (POV del campo B, Yogmungard): 'sin correa… comunión, no contención; qué banquete tan apócrifo'; DECIDIÓ buscar a Akari para la conversación del diálogo con la propia oscuridad (semilla caliente). Dark Shadow: '¡LA SERPIENTE MOLA MUCHÍSIMO! ¡Quiero que me monte!'."
iida-001,Iida Tenya,1-A,delegado/aliado,Engine,amistad,5,volátil,media-alta,"S4/D4: Akari se lo GANÓ — disculpa por no hablarle antes, elogio público a la sub-delegada, le pide ayuda con las normas. Iida lo adopta ('¡esa es la actitud!'), le prepara resumen de normas. >>> NUEVO/subió 0→5 en un día (era trivial: recto y noble). Aliado de clase."
koda-001,Kōji Kōda (Anivoice),1-A,amigo (mesa de guardianes),Anivoice,amistad,4,volátil,media,"S4/D4: Akari lo INCLUYÓ en la mesa (comía solo, tímido). Emocionado hasta las lágrimas de pertenecer; le enseña una foto de un gorrión que rescató. >>> NUEVO 0→4. Marginado que por fin pertenece."
aoyama-001,Aoyama Yuga,1-A,amigo (mesa de guardianes),Navel Laser,amistad,4,volátil,media,"S4/D4: Akari lo vio TRAS su fachada (soledad, Quirk que le duele) y lo INCLUYÓ en la mesa; deja de performar, puede estar en silencio. Tocado hasta las lágrimas. >>> NUEVO 0→4. 'La mesa más hermosa en la que me he sentado.'"
monoma-001,Monoma Neito,1-B,rival inter-clase (cómico),Copy,rivalidad,2,volátil,baja,"Cruzada anti-1-A desactivada con guasa (gag 'te vigilo'). Rivalidad cómica, nivel 2. Se descoloca con el buen rollo. S11/D12: interrogó a Ibara ('¿te ha reclutado?' / 'entrenamos vides' / 'no hay ajá, Monoma-san'); contramedida: 1-B se aprenderá el single mejor que 1-A."
bakugo-001,Bakugo Katsuki,1-A,rival sano (respeto reticente),Explosion,rivalidad,4,volátil,media,"S4: fichó a Akari como 'amenaza que sube' (por lo de Todoroki). S5/D5: ENCUENTRO al alba (entrenaba solo). Lo midió sospechando manipulación; la DESCARTÓ al ver que Akari ni se defendía ni presumía. Akari le ofreció ser su 'frontón' (rival que devuelve cada golpe mejor) reconociendo que aún no le llega (Quirk inestable, coste alto), sin pelotear, de frente. Bakugo lo aceptó a su modo ('rival sano; como te acomodes, te reviento, anémico'). >>> Rivalidad 2→3: de amenaza a RIVAL con respeto reticente (la única forma de afecto que Bakugo da). Choque directo aún pendiente, ya sin veneno. Respeta a los que madrugan. S6/D5 (izakaya): 3→4 — noche entera con el Bakusquad; Akari RODEÓ a propósito su herida de Deku (pudiendo usarla para ganar una discusión) y se lo dijo; Bakugo se abrió ('con Deku hay cosas que son mías'; 'bienvenido a aguantarlos conmigo'). Le encontró el punto ciego (sudor neutralizado por resbaladizo/aislante) y lo respeta como cabeza táctica ('piensa mientras el resto pega'). De rival con respeto reticente a CASI amigo. NIEBLA S6: además de 'hay alguien sin nombre' (Akari bebió en el 'yo nunca'), Bakugo VIO la burbuja con Mina y no se tragó la excusa de irse juntos ('a mí no me engañas, Hayami') — sospecha específica Akari↔Mina, que se CALLA (no vende a nadie). S10/D11 (ev-124/126/130): ELOGIO CRÍPTICO en la mesa ('es de PELOTAS... que es lo que hay que tener para hacer el gilipollas delante de toda la clase y que encima te salga bien' — editorial a página completa en idioma Bakugo); registró que Akari sella las heridas que ÉL abre (Kirishima); ante el single: 'escribiendo...' y BORRADO (descarga hecha — 20/20). La libreta mental suma páginas; la carta sigue en su mano. S11/D12: ⚠️ DETECTÓ EL FRENO ('va un 20% por debajo de algo, SIEMPRE; el espectáculo es la parte que enseña para que no mires la que guarda') → página privada: 'Exámenes 5 junio. Obligarle a soltar el freno.' + posdata que negará: 'la serpiente es objetivamente cojonuda'. No es chivato: es rival."
ectoplasm-001,Ectoplasm,profesor UA,Profesor de matemáticas,Clones,mentor-menor,3,volátil,baja,"S3: reconoció la aptitud matemática de Akari ('matemática hecha verso'); le lanza problemas a propósito. Respeto académico, nivel 3."
MESA-GUARDIANES,Mesa de los Guardianes del Ocaso,grupo/orden,Comunidad fundada por Akari,—,grupo,—,—,alta,"S4/D4: 'orden' fundada por Akari en la cafetería — los que miran su abismo y montan guardia (los del margen): Todoroki, Tokoyami, Kōda, Midoriya, Aoyama + Akari. Refugio donde nadie finge. Grupo de chat creado. 'Ninguno vuelve a comer solo.' Liderazgo social de Akari. S10/D11: +SHOJI (7º miembro; consenso ojo a ojo — ver shoji-001). 'El ocaso agradece centinelas' (Tokoyami)."
kirishima-001,Kirishima Eijiro,1-A,amigo (Bakusquad),Hardening,amistad,5,volátil,media-alta,"S6/D5 (izakaya): 0→5 en una noche. El 'sol viril' del grupo, emocional y leal; acoge a Akari sin reservas ('bienvenido a casa hasta que la muerte nos separe'), llora con su brindis sincero. Se ofrece de 'ancla' aislante (cuerpo endurecido = roca) para el plan de absorción de Kaminari. S7/D6: mañana entera de compras (espejo entusiasta del glow-up: 'ese eres tú de verdad'); pidió foto cuando estrene el look. S10/D11 (ev-126): nudillos sellados con la saliva-savia tras su combate con Bakugo ('¡¡SUPER VARONIL!!'; se lo enseñó a media clase — vector del rumor 'el nuevo sella cortes'). Su sangre catada sin saberlo (tipo O, 'la cantera construida': mineral, generosa, con una veta antigua de esfuerzo — roca construida capa a capa sobre algo blando que nadie ve)."
sero-001,Sero Hanta,1-A,amigo (Bakusquad),Tape,amistad,4,volátil,media,S6/D5 (izakaya): 0→4 en una noche. El pinchón perceptivo del grupo; OLIÓ que 'hay alguien' en la vida de Akari (le tendió la trampa del 'yo nunca'). Su celofán = mejor aislante táctico para el plan de Kaminari. Grabador oficial del grupo; pagó la ronda de castigo. S7/D6: compras + almuerzo; recogió el titular de la apuesta Akari↔Momo para repartirlo por la clase ('esto va a estar bueno') — vector de la coartada.
shoji-001,Shōji Mezō,1-A,GUARDIÁN (mesa del ocaso),Dupli-Arms,amistad,5,anclado,alta,"S9/D10 (Hª del Arte): primera voz — 'ser mirado y ser VISTO no es lo mismo'. NUEVO 0→3. ⭐ S10/D11 (ev-124): INVITADO A LA MESA DE LOS GUARDIANES por Akari — propuesto A la mesa (no por encima de ella), consenso cobrado ojo a ojo; aceptado (Todoroki: 'hay sitio'; Kōda apartó su bandeja 15 cm; Aoyama: 'esta mesa aprecia a quien no necesita brillar para ocupar espacio'; Dark Shadow: pulgar arriba). Frase-sello: 'Puedo montar guardia en seis direcciones. Nadie me había pedido nunca que la montara hacia dentro.' POV propio: años de caber en todos los sitios sin pertenecer a ninguno; la mesa se recolocó alrededor de sus seis brazos sin que ningún hombro girara hacia otra parte. 3→5, ANCLADO (hito de pertenencia)."
ojiro-001,Ojiro Mashirao,1-A,amigo (sparring),Tail,amistad,4,volátil,media,"S9/D10: primera aparición (nota sensata en Midnight). 0→2. S10/D11 (ev-126): COMBATE vs Akari — sparring técnico de primera (artes marciales reales, cola con timing propio); derrota encajada sin resquemor. Akari le REGALÓ su patrón ('repites tres fintas y barrido cuando te falta el aire; rómpelo y eres otro nivel') → 'Nadie me había dicho nunca QUÉ. Todos dicen «muy sólido, Ojiro» y pasan al siguiente. ¿Repetimos la semana que viene?'. Labio sellado con la saliva-savia ('eso en rescate vale oro'). Su sangre catada sin saberlo (tipo A, 'el dojo': limpia, dieta espartana, el cuerpo mejor gobernado de la clase). 2→4; sparring semanal pactado."
mirio-001,Mirio Togata (Lemillion),3º (Tres Grandes),aliado/modelo,Permeation,amistad,6,volátil,alta,"S9/D10 (zona de 3º): uno de los TRES GRANDES. Akari se infiltró para conocerlos y Mirio lo acogió con calidez humilde. Consejo de oro: 'la fuerza de verdad no es para ganar, es para sostener' + 'el mejor rescate es el que no sale en cámara' (le firmó la conclusión del ensayo). CONTACTO conseguido. NUEVO 0→4. Modelo del héroe invisible/humilde; aliado en la élite. (Se azora con 'auténtico héroe'). S10/D11-12 (ev-121/131): le agradeció la frase que redondeó el ensayo ('¿eso dije? ¡qué listo soy cuando no me escucho!'); RETO DE CORRER: perímetro 5:45 'no aviso, no espero, no bajo el ritmo' → contraoferta 5:30 de Akari → 'a las 5:30 yo ya voy por la segunda vuelta. La liebre eres tú'; PRIMERA CARRERA JUNTOS (D12 alba): ritmo exacto, lección 'el cuerpo llega; lo que se rinde antes es el RELATO que te cuentas sobre el cuerpo' + SEMILLA DE INTERNADOS: 'con Sir (Nighteye) no me he reído jamás y es de quien más he aprendido. Elige al que te incomode; lo cómodo ya lo traes de casa.' 4→5. S11/D12: gestionó la petición a Sir Nighteye ('dejó el bolígrafo… 34 segundos sin interrumpir… APUNTÓ tu nombre — teatro deliberado, Sir no apunta') → cita concedida: 9 jun 16:40, 12 minutos, cauce de pasantía; '¡''DIGNO'' ES EL QUE SE PRESENTA!'; acompañará a Akari hasta la puerta. >>> 5→6."
tamaki-001,Tamaki Amajiki (Suneater),3º (Tres Grandes),conocido,Manifest,amistad,1,volátil,media,"S9/D10: uno de los Tres Grandes. Timidez extrema (le habla a las paredes). Akari le tendió un puente SIN palabras y él lo devolvió. NUEVO 0→1. 'Dice menos y sabe más que los dos juntos' (Mirio). S10/D11 (ev-121): CONTACTO conseguido (vía Mirio, que le sacó el móvil del bolsillo con confianza de década: 'los contactos... los gestiona... Mirio') — grupo 'Big 3 + logística' (Akari = logística). Comunica por stickers (una gamba escondiéndose). 1→2."
pony-001,Pony Tsunotori (Poni),1-B,companera (a ayudar),Horn Cannon,aliado-potencial,1,volátil,media,"S13/D14: NUEVA (mencionada por Kendo, aun no conocida por Akari en persona). Estudiante extranjera (EE.UU.); perdida en las teoricas por el idioma, casi abandona (maleta hecha) tras una derrota en combate -- Kendo la levanto sola. Akari la va a ayudar (lunes, via Kendo): apuntes ES/JP + canciones-leccion para el temario + comida 'las tres' con Uraraka para el sentido de pertenencia (mis-033). Arco de PERTENENCIA.
