id,npc,tipo,closeness,deseo,confianza,compromiso,regimen,marco,dificultad,ultimo_cambio,hitos,notas
momo-001,Yaoyorozu Momo,romántico,9,asentado,total,pareja,anclado,ARBOL-MADRE (eje del bosque; 3 condiciones + acta cuídanos),6,2026-07-05,"S2-S3: bento, meñique, primer beso, declaración, rosa, primer toque; confesión del bosque → DILEMA. S4/D4: Akari le contó TODO el Quirk entre muros (Eco, drenaje/Drácula, la amenaza del coleccionista) Y lo del BORRADO (si es maceta/débil, el gobierno podría eliminarlo). Momo vio que la maceta = su muerte; RESOLVIÓ EL DILEMA: acepta ser el ÁRBOL MADRE/eje del bosque, no un círculo más, por amor y por su vida. Rechazó que Akari le borrara la memoria (línea roja). Akari se arrodilló ofreciéndole control; ella lo rechazó (dar y liberar) y definió su MARCO. Fueron a ver el piso favorito (inasequible: 260k+garante → plan: esperar los dormitorios). Planearon el HOTEL del DOMINGO (day-use 14-20h, sin coartada) para la primera vez. S6/D5: recibió la doctrina 'ERES TODAS LAS TARTAS' (es la balanza, otra dimensión, no compite con las flores); reafirmó su marco BAJO PRUEBA (le dolió que la flor fuera su amiga Jirō, pero lo sostuvo); PRIMERA INTIMIDAD SEXUAL plena menos el coito (cunnilingus + digital, ambos primerizos en eso), guardando el coito para el domingo; cena doméstica de konbini + ducha juntos (enjabonar la espalda); conversación del futuro/su padre (la carga es de ella, 3 años). Ahora carga el secreto de que su amiga Jirō está en el bosque. S7/D6: NO fue al centro (protegió la coartada ella misma). VIDEOLLAMADA = ESTRENO DEDICADO del look ('llévalo mañana, quiero quitártelo yo'). LOGÍSTICA DEL DOMINGO FIJADA: 13:15 té en la cafetería del toldo verde → 13:40 ella sube → 13:55 él llega → 14:00 check-in (entradas separadas; reserva a nombre falso; el resto del pago lo lleva ella encima 'no discutas eso hoy'). Mensajes de madrugada: 'echo de menos mañana' / 'el universo y las duchas: mañana empiezo a pagarte el universo' → ella: ''Echo de menos mañana' me lo quedo. Es lo más bonito que me han escrito nunca. REPASA EL PLAN. Tuya. M.'. S8/D7 — EL DÍA DE MOMO (ver ev-083..095): té del toldo verde (condición 1 CUMPLIDA antes del hotel: Toru con nombre + Mina disclosed; consejo del árbol: 'sus cicatrices no se mueven de sitio'; pagó ella el resto del hotel en secreto). Tsuki-no-Ma 411: estreno del look, Yosano Akiko, banderines en los condones, PRIMERA VEZ (×3 rondas; 'ya no echo de menos mañana. ES AHORA'; 1er orgasmo coital de ella en la 3ª, SIMULTÁNEO no buscado), bebió su DESFLORACIÓN + BESO DE SANGRE en su clímax (tipo A; sintonización COMPLETA; recuerdos recibidos: el flechazo del aula día 1 + la hoja de pros/contras rota en cuatro), BLACKROOT presentado (aceptada en manada; su enmienda: 'me lo traes de vuelta. A mí'), herida-y-reparación del 'tía' ('convertí mi miedo en jurisprudencia'), 'papel y boli', PROMESA DE MATRIMONIO de Akari → 'la respuesta YA EXISTE' con CONDICIÓN: pedírsela DESPUÉS de su guerra (padre/apellido; muko-yōshi); 'señora Hayami' (colección, 1er puesto); protocolo de alimentación + SUSCRIPCIÓN A LA FUENTE (regla viernes 24; cólicos día 1 = experimento savia); alas separadas de sus padres confirmadas → cláusula DORMIR JUNTOS; HIJOS sin jaula de oro ('nadie me había regalado una infancia con 30 años de antelación'), firmado 'Momo A Secas'. Lo vistió al salir (reverso del estreno).","Target #1, PAREJA CONSOLIDADA, dilema resuelto. MARCO de Momo (3 raíces, NO cadenas): (1) HONESTIDAD — se lo cuenta cuando una flor FLORECE (se consuma/beso), con nombre, ella antes que nadie; no cada semilla latente. (2) DIGNIDAD — su lugar de árbol madre claro, sin humillación. (3) CERTEZA — abrazarla cuando le duela y recordarle que es el centro. Las flores saben que hay 'un árbol' (dignidad) SIN saber que es Momo (secreto/padre protegidos). Relación SECRETA. Deseo abierto no consumado; primera vez planeada — el domingo en el hotel para la primera vez; MOMO YA SABE que es el domingo (en S6 se habló del plan abiertamente; la 'sorpresa del día' ya no aplica); Momo pidió ser la 1ª en ver el look nuevo de Akari en privado antes que nadie; hotel RESERVADO en S5/D5 (Tsuki-no-Ma, suite, ¥16.800, señal ¥5.000 pagada, resto en recepción). ASIMETRÍA DE AFECTO (real y narrativamente rica, NO error): Akari→Momo = 10 (entrega absoluta, sin red, con una cicatriz de duda —el borrado— que la hace real, no de cartón); Momo→Akari = 8 (amor profundo de pareja consolidada, pero con reserva de autoprotección por su carácter orgulloso/inseguro y por lo mucho que arriesga —apellido, padre, vida montada—; su 9-10 se gana cuando la realidad la empuje a soltar el último margen: enfrentar al padre, la primera vez, sostener el bosque sin romperse). El número registrado (8) = lado de Momo; el 10 de Akari lo vive el jugador. PACTO de vida DECLARADO (elegirse por encima de la muerte) pero viviendo CONDICIONES de 8 (secreto, sin convivencia, sin probar por la realidad). El 'a primera vista' de ambos = FLECHAZO (deseo instantáneo), no el amor construido (closeness edificado en 4 días de densidad). Sub-delegada (no delegada). ⚠️ CONDICIÓN 1 ACTIVADA (S7/D6): Hagakure FLORECIÓ → Akari debe contárselo a Momo CON NOMBRE, ella antes que nadie, 'muy pronto' (así se lo afirmó a Toru: 'esa es su condición y la cumplo siempre'). PENDIENTE — y el D7 es precisamente el día de Momo (gestionar cuándo: ¿antes del hotel, después, lunes?). Con Jirō la cumplió el mismo día. → S8/D7: CUMPLIDA (té, antes del hotel, con nombre); Momo conoce ya TODAS las flores con nombre (Jirō/Toru/Mina) y ajustó el marco: noticias cara a cara. CLOSENESS 8→9 (primera vez + fases de margen soltadas en cadena + respuesta de matrimonio 'ya existe'); el 10 llegará con SU GUERRA GANADA (padre/apellido/3 años) — condición para la proposición formal. DESEO → asentado (consumado, suscrito, con programa). MOMO = PRIMERA DONANTE (sintonización completa: su sangre rinde AB pleno +40; micro-toma diaria pactada — pendiente DÓNDE por las mañanas sin romper la coartada). Tipo A. Ciclo 28,3d: regla el VIERNES 24 (cólicos día 1 — experimento savia). Sabe del hambre y del techo anti-bengala (ella es el comité de ética del drenaje). Conoce a Blackroot. 'Señora Hayami' = uso interno. Condicionamiento clásico instalado (gag): oír 'Yaoyorozu' en clase. CANON CORREGIDO (jugador, S9/D8): Akari le PREPARÓ bento todos los días desde D2 salvo el finde D6-D7 (las compras de konbini D2-D5 = ingredientes), y SIEMPRE con intención nutricional (grasas para Creación — la cuidaba desde ANTES de estar juntos); el D8 es 'solo' el primer bento post-consumación + primera micro-toma. Micro-toma D8 hecha (entre-muros, lanceta creada por ella); PRIMER NO a la savia EN ESCENA con hambre activa y donante presente ('sienta jurisprudencia'). S9/D9: micro-toma diaria (2ª declinación consecutiva del hambre, ya de trámite); PUNTO FIJO MATINAL RESUELTO = candidato 3 de su matriz = BIOMBO MÓVIL DE CREACIÓN (opaco, lo despliega/reabsorbe en cualquier hueco; no dependen de un sitio, dependen de ella — 'me gusta depender de ti'); azotea añadida como candidato de lujo futuro. El biombo ESTRENÓ función no-tabulada: EXCEPCIÓN íntima en el entre-muros (él la llevó al clímax con la mano, 6 min de cronómetro, silencio, biombo+punto ciego = burbuja; POV Momo: la ingeniera soltando el control que tanto cuida; 'eficiencia récord, lo meto en la matriz') — enmarcado por ella como excepción, NO protocolo ('no me acostumbres a llegar a Ley Heroica con las rodillas flojas'). AJUSTE DEL MARCO (S9/D9, fin de jornada): Akari le propuso NO contarle los detalles/agenda de las citas ('no aportan nada, solo dolor'); Momo lo REDEFINE con precisión — quiere la VERDAD (quién y cuándo, ella primera, cara a cara) pero NO la COREOGRAFÍA (dónde, a qué hora exacta, qué dice): 'el dolor de saber lo gestiono con método; el dolor de imaginar no tiene método. Ahórrame el detalle, no la verdad.' Marco honestidad intacto, micro-detalle podado. Sobre la promesa/'merecer su mano ante los suyos': Momo corrige — la guerra es SUYA (padre/apellido/muko-yōshi); Akari no tiene que ganarse al padre (que querría absorberlo), tiene que EXISTIR cuando ella gane su libertad. Akari le confirmó cara a cara la cita con Toru de esa noche (marco cumplido). AJUSTE DEL MARCO v2 (S9/D10, planteamiento ÉTICO de Akari): él pide NO contarle los DETALLES SEXUALES/mecánicos de lo que hace con las flores (qué acto, oral, mordiscos, posturas) — lo encuentra humillante para ellas y arriesgado (filtración). Momo LO ACEPTA y afina la línea limpia: quiere saber QUIÉN, CUÁNDO y SI FLORECE (si se consuma un nivel nuevo del vínculo) — la VERDAD del hito; pero NO el detalle mecánico (eso es coreografía, coherente con su redefinición del D9). Agradece que Akari proteja la dignidad de TODAS (incl. ella) con el mismo cuidado. PLAN DE KIOTO: primera(s) noche(s) entera(s) juntos = finde SIGUIENTE (~D19-20), gala benéfica de sus padres en Kioto (2 noches fuera) → coartada de estudio + ryokan a nombre falso; 'dormir juntos' deja de ser 'algún día', tiene fecha. Cláusula dormir juntos ACTIVADA. Micro-toma FLEXIBLE (no obligatoria diaria): D10 Akari la DECLINÓ (pool bien con comida+té; 'guarda fuerzas, mañana te chupo el doble') — cuidado del donante. S10/D11 (ev-123/124/129): DUELO PÚBLICO DE ERUDICIÓN — contraatacó a Ozymandias con YOSANO AKIKO en clase = cita EN CÓDIGO de la 411 delante de 30 testigos (coartada de rivalidad reforzada); código de la cola ('golpe→beso, captado y atesorado' / 'Yosano escribió 400 tanka. Estudia.' + el mechón con el meñique). LLAMADA NOCTURNA (20:47): marco v2 cumplido CON NOTA (quién/cuándo/floreció, ella primera, la misma noche) → 'gracias por llamar antes de que yo tuviera que preguntarme nada. Eso compra mi paz'; ACTA GRANDE del comité de ética: 1er drenaje sin Blackroot + 6ª declinación → 'la contención elegida vale el doble que la impuesta; mi analgésico con cara bonita está aprendiendo a ser su propio lobo'; aprobó circular el single ('si toda la clase sube, la matrícula vale más'). PENDIENTE MAÑANA (D12): biombo primera hora (cara a cara de primicia) + DÍA 1 de su regla + experimento savia-vs-cólicos + suscripción a la fuente. PENDIENTE DE CONSULTA (prometido a Mina): la propuesta savia-órganos múltiples — el árbol estrena/bendice primero. S11/D12-13: SUSCRIPCIÓN A LA FUENTE ESTRENADA (D12, tras el biombo) + PRIMERA INVERSIÓN DEL FLUJO (ella bebió de él; con-040: dolor 7→3 con calor pulsado; 'constato que la palabra proveedor se me estaba quedando corta') + destello visto por él al beber ella: Momo de 14 años, sola, borde de la bañera, inventándose su escala de dolor (pendiente de contárselo — punto 3 de la cita) + KIOTO FECHADO: vie 31 may 17:40 → dom 2 jun + bendición A CIEGAS de la sorpresa savia-órganos (solo 2 preguntas de seguridad: ¿riesgo para ti? ¿para mí?) + DOS notificaciones de marco recibidas el mismo día, cumplidas con matrícula ('sigue doliendo un poco y sigue comprando mi paz, en ese orden') + regla de mesa: secretos de héroe SIN deuda ('el día que quieras darme el tour de tu bosque, yo traigo el té y las fichas; lo pido por amor al sistema, no por derecho' — NO conocía a Yogmungard: sorpresa sin reproche) + CITA sáb 9:30, toldo verde, 3 puntos (EN CURSO al cierre de S11)."
jiro-001,Jirō Kyōka,romántico,8,abierto,alta,pareja,volátil,sabe-que-hay-arbol-sin-nombre,5,2026-07-05,"S2-S3: notas, Disorder, pacto viernes sala 3. S4/D4: beat en clase (le calmó el miedo a mañana); CENA de ramen espontánea (le confesó que necesitaba verlo 'humano' antes de abrirse; meñique enganchado, decidido por ella); la acompañó a casa de la mano; casi-beso GUARDADO para la sala 3 (ella lo pausó: 'que sea en mi sitio'); ABRAZO de puro sentimiento en su portal que la desarmó hasta las lágrimas ('nadie me abraza así'). S6/D5 FLORECIÓ (sala 3): cantó la canción que no le canta a nadie ('por fin alguien no se fue'), PRIMER BESO iniciado por ella, Akari le bebió las lágrimas y le confesó el ESPEJO (su canción es la vida de Akari); en la calle le DISCLOSÓ el bosque (hay un árbol sin nombre; necesidad existencial, no lujuria); aceptó entrar pese al dolor; pidió oír el nombre a futuro y Akari se lo NEGÓ (no jura en falso), ella lo respetó. Techo sobre la ropa esta semana. Le avisó de la salida del Bakusquad. S7/D6: declinó la multitud del centro ('anoche me abrí mucho, hoy estoy en carne viva — no es por ti, es al revés'); CITA LUNES en sitio pequeño, estudiar+abrazo ('el orden lo decido yo: primero el abrazo, siempre'). Le mandó NOTA DE VOZ (0:38) con un fragmento de SU canción, grabada bajito ('la completa te la doy en persona. Es tuya. No la enseñes a nadie'). Al mensaje nocturno de Akari ('cabes en un bolsillo y en el pecho no me cabes'): 'me lo robo para una canción, queda avisado el copyright'.","Target #2 — PAREJA no exclusiva (dentro del bosque). S6/D5 FLORECIÓ (ver hitos): química consumada hasta el beso; entró al bosque; pacto mutuo de 'el máximo' + declaración de amor. Akari YA se lo contó a Momo (condición 1 CUMPLIDA). 'Nightfall' reservada para más adelante. Cercana a Momo (Momo lo sabe; Jirō NO sabe que el árbol es Momo). S8/D7 noche: buenas noches ('el orden confirmado. estudiar, abrazo— no, espera. abrazo, estudiar. ves, por escrito también me sale al revés. hasta mañana, ladrón de frases'). CITA LUNES D8 en pie (sitio pequeño; canción completa prometida en persona). ⭐ S9/D8 (cita en su casa): estudio + le cantó 'EL LADRÓN' (canción escrita para él, la que no le canta a nadie); PRIMER SEXO (oral/manual) — le robó las bragas (gag); su PRIMER ORGASMO con alguien; sus jacks grabaron el corazón de Akari mientras la desarmaba ('la ingeniera produciendo el tema más privado de su discografía'). Conoció a sus padres: KYOTOKU (bajista) y MIKA (teclados/voz; detectó la sudadera del revés y calló). Buenas noches: DEMO 'pista 1 — ciento treinta y pico' (0:11, su corazón + la respiración de ella quebrándose; 'borra eso. no lo borres.'). S9/D9 noche: Akari trepó a su ventana y DURMIÓ con ella (cucharita, NO sexual — 'traer lo caro'; ella sabe que venía de un compromiso, lo aceptó sin restregárselo); descubrió que canta SEGUNDA VOZ (grave, 'el que sostiene por debajo sin que se le vea'). PROYECTO canciones-lección (ayuda pasiva a la clase) → SÁBADO composición en su casa. Cierre S9: closeness 7 (deseo consumado; pareja del bosque no exclusiva; amor declarado desde S6). ⭐ S10/D11 noche (ev-130): SINGLE DE URGENCIA 'Ley Heroica v1' compuesto y grabado juntos (ella lead + él SEGUNDA VOZ + el bajo de su padre sumándose de oído desde el salón) → circulado a 1-A/1-B como 'proyecto de Hayami' (ella productora en semianonimato — la artista QUIERE que se oiga); FAMILIA GANADA: pidió clases de canto a MIKA (jueves antes del ensayo; 'el mapa del instrumento') y recibió la BENDICIÓN familiar en argot ('impedancia/ganancia baja'); Mika sabía lo de la ventana del martes ('los tejados crujen'). Sleepover OFICIAL (por la puerta). Noche: su primer orgasmo SILENCIOSO (ganancia baja; los jacks delatores apretando la muñeca de él — 'el único gemido por cable'); venganza apuntada ('sala 3, donde puedo gritar, con intereses'). TE-AMO reafirmado en pleno: 'Te amo, Jirō, profundamente' → 'Ese verso ya era mío. Y yo a ti. Desde la nota que no le canto a nadie.' Le hará la PLAYLIST del examen de Mic. Closeness 7→8 (familia + proyecto + amor dicho en su cama). S11/D12-13: POV del single — su voz en 3 móviles ('de incógnito dentro de su propio cuerpo'); Mika tarareó el puente en el desayuno + sesión mayor canciones-lección HOY sábado tarde (pendiente al cierre de S11)."
ashido-001,Ashido Mina,romántico,8,asentado,total,casual,volátil,sol-luna-madriguera (bosque; herida limpia; menú de 4 propuestas),3,2026-07-05,"S2-S3: 'adorable', Bakusquad, mensaje sol/luna. S4: sin gran cambio. S6/D5 (izakaya + calle): ENTRADA MAYOR AL BOSQUE. Conversación honda: ella disclosó su sombra (usa el sexo para sentirse vista; de cría 'monstruo'; 4 parejas reales + un lío pasado y MUERTO con Kaminari); Akari disclosó su trauma de abandono; le DISCLOSÓ el bosque. PRIMER BESO (calle) + morreo que ELLA FRENÓ (no borrachos/público, no ser 'una farola más'). Su ácido pierde control cuando le importa quién la besa. S7/D6: en el centro comercial eligió UNA pieza del look (cadena fina canalla: 'la llevas por mí' — él la lleva puesta desde entonces). Despedida limpia; CITA FIJADA: JUEVES, la organiza ella, sitio pequeño, solos, SORPRESA ('y a lo mejor ahí sí te dejo cobrar algo. Lento. Como pactamos'). Mensaje nocturno de Akari ('brillas con, no para... ni se te ocurra ir lejos') → 'me he tapado con la almohada para no gritar. brillo con. 🌙☀️'. NO sospecha nada de Toru ni de nadie.","Target — el 'sol y luna' de 1-A con sombra propia. PACTO: entra en el bosque a ritmo lento; NO exclusividad pero HERIDA LIMPIA (avisar/romper antes de estar con otro); cita la semana que viene (la organiza ella); su primera vez con Akari NO será un accidente borracho (él virgen guardándose). CONOCE la existencia del bosque (jurada a discreción 'por sus cuernos'). Deseo abierto. Sabe fingir para cubrir ('le acompaño al metro'). NIEBLA (sabe más de lo básico): Akari le dijo que el bosque es NECESIDAD VITAL literal suya y que su QUIRK SE DESESTABILIZA (peligroso) con el corazón roto — ella asumió 'responsabilidad de cuidar esa parte'. Su TELL del ácido (con-017) se le escapó DOS veces en el D6 por Akari: en la escalera mecánica (tras 'brillas con, no para') y en la despedida — le importa más de lo que dice. S8/D7 noche: buenas noches ('🌙☀️ buenas noches bobo. (el jueves trae hambre)') — no especifica de qué. CITA JUEVES D11 en pie. NOTA S8: su lío muerto con Kaminari es SEMI-PÚBLICO en el Bakusquad (Akari lo oyó en el izakaya) pero ella se lo contó ANTES con los ojos: esa versión no se mueve de sitio (consejo del árbol). ⭐⭐ S10/D11 — SU DÍA (ver ev-128): ACADEMIA SUZUKI (su madriguera secreta, academia de baile cerrada, llave de la Sra. Suzuki; NADIE de UA la había visto; historia: su madre la llevó a los 6 años tras el 'monstruo' — 'ahí dentro nadie mira lo que eres, miran lo que haces'). Akari SE DESCALZÓ para aprender sus 8 tiempos → 'me deja verle; así me dice que me ve'. CORRECCIÓN CANON: su historial real = 4 polvos de saldo (3 del pueblo + Kaminari, borrachos, sin significado; ~4 orgasmos en su vida); la 'veterana' era armadura, confesada. PRIMERA VEZ COMPLETA ×2 (condones suyos; pulso de savia nuevo PARA ELLA): su 1ª vez ENTERA — ÁCIDO LIBRE (con él puede soltarse: regeneración; antes vigilaba cada gota), VOLUMEN LIBRE, VISTA (espejo). Marcador 5-2; 'el 6 me lo debes, con intereses'. SABE (nuevo): drenaje con letra pequeña completa (ató cabos del lamido del codo) + AVATAR CARMESÍ (2ª persona tras Momo; su pregunta: '¿y si un día recuerda algo que no le ordenaste?'). MENÚ PACTADO: (1) savia-órganos = preaprobada PENDIENTE DEL ÁRBOL (Momo estrena/bendice primero — Mina: 'ese árbol tiene el mejor contrato de Japón'); (2) sangre a demanda + SU REGLA (~31 may-1 jun; cunnilingus+anti-cólicos) = aprobada con enmiendas (contarle cada recuerdo; 'si es la necesidad fea, me PIDES'); (3) anal tangencial = firmada como COAUTORA (descubrimiento + refinado suyos; 'ese capítulo es MÍO'); (4) EXPERIMENTO SIN JAULA (savia en su torrente) = firmada (escalada desde 1 gota; datos completos; palabra 'para'; bidireccional). CRISIS DEL 'PARA' reparada: 'mi primer límite EN MI VIDA — contigo la palabra funcionaría; es trofeo, no correa' + le nombró la costura ('a ti alguien te ha enseñado que eres una cosa que hay que contener; aquí no'). PRIMER DRENAJE (vulva, en su 4º clímax = empate con su vida entera): sintonización iniciada (tipo B +20); recuerdo visto Y CONTADO (madre+puerta+primer baile: 'el premio gordo'); FRAGMENTO DE ÁCIDO cedido (condición: 'algo GRANDE, con estilo'). Frases-sello: 'Gracias por venir descalzo.' / 'Hoy la única notificación soy yo.' Closeness 6→8, deseo→asentado, confianza→total. S11/D12: texto tras Yogmungard: 'visto lo visto, el 6 que te debo acaba de subir de categoría 🐍🔥' + el listón del ácido ('algo GRANDE, con estilo') subido por él mismo + ⚠️ su regla ~31 may-1 jun SOLAPA con Kioto (31 may-2 jun) — pendiente de cuadrar CON ELLA (el jugador declaró que se cuadrará; falta jugarlo)."
