id,npc,tipo,closeness,deseo,confianza,compromiso,regimen,marco,dificultad,ultimo_cambio,hitos,notas
hagakure-001,Hagakure Tōru,romántico,8,abierto,alta,casual,volátil,verse-y-ver (transparencia total; pacto de salida; ENTRADA AL BOSQUE RATIFICADA),4,2026-07-05,"S3-S6: 'estilosa', proyecto de estilismo, número conseguido, rubor leído. S7/D6 — SU DÍA (floreció ENTERA): PROBADOR (primer beso + Akari le reveló que LA VE ENTERA + primer orgasmo de su vida, manual). Dirigió el glow-up completo (el 'boceto descartado' era un look para él; la chaqueta CARMESÍ = 'es tú' sin saber por qué). Tarde en el hostal: sexo ORAL mutuo (1ª vez de ambos; sin coito), 'pase al revés' (él le describió el cuerpo entero por la sangre), detectó el sabor del Verdant ('sal y algo verde'). DISCLOSURE del Quirk (savia, percepción, el porqué del rojo) y luego EL BOSQUE COMPLETO (5ª consciente): fricción honesta ('desigual'), PACTO DE SALIDA antes del de entrada, arquitectura de dignidad; se NEGÓ a adivinar nombres. SEGUNDA PIEL DE SAVIA: SE VIO en el espejo por 1ª vez desde los 5 años (lunar mandíbula izq., flequillo, 'la risa de mi madre'); oral frente al espejo viéndose; 'como la Toru de mañana renuncie a ESTO la mato yo'. Lo cuidó; okonomiyaki; cine; beso del limonero en su portal. Mensaje final: 'el mejor día de mi vida y lo he VISTO'.","FLORECIÓ (closeness 4→7 en un día — justificado: primer beso, primera vez sexual de ambos, dos secretos mayores intercambiados, hito vital de verse). RATIFICADO S8/D7 11:47 ('la Toru de mañana ha revisado el contrato de la Toru de ayer buscando defectos de forma. No los hay. FIRMO... Quiero el MARTES'): DENTRO DEL BOSQUE. CITA MARTES D9 confirmada por Akari ('convertido en sí'); sitio sorpresa elegido por ella ('tres listas'). Buenas noches del D7: 'dile a TU martes que se vaya preparando... buenas noches, colega que me ve ✨(esa soy yo)'. El TE-QUIERO sigue ARMADO Y SIN DISPARAR (buscará su momento limpio — quizá el martes). NO sabe: drenaje, borrado, avalista, ningún nombre del bosque. Promesa de Akari: NI UNA MENTIRA ('si no puedo contarlo, te digo que no puedo'). SABE el porqué del rojo (savia, deducido por ella: '¡te vestí de tu propia sangre!'); lo que NO sabe es la capa del AVATAR CARMESÍ (esa ironía se le debe algún día). REGALO PERMANENTE: la segunda piel ('no caduca' — puede pedir verse cuando quiera). Deuda económica de Akari con ella: ¥33.800. Familia: padre translucidez parcial, madre bioluminiscencia leve; invisible total desde los 5 (no recordaba su cara). Vocación: heroína de RESCATE. Toque de queda 21:30 semana / 23:30 finde. Si dice sí: cita la semana próxima (día que elija, salvo jueves; martes ofrecido condicionado a reprogramar a Ibara). FRASE-SELLO del limonero: 'Gracias por verme. Todo lo demás de hoy es propina.' TE-QUIERO ARMADO Y SIN DISPARAR: rehusó decirlo en la primera respuesta ('no te voy a estrenar la promesa mintiéndote'), confesó 'me gustas desde antes de hoy, desde el susurro en clase', y tras el espejo: 'estoy PELIGROSAMENTE cerca, y me niego a decírtelo por primera vez cubierta de tus fluidos'. Promesa literal de Akari: 'Prefiero hacerte una herida limpia antes que una caricia falsa.' Su herida doble nombrada por ella: ser vista como MUJER y como ARTISTA ('que te digan eres una genia POR LO QUE HACES y no un qué mona'). ⭐ CITA MARTES S9/D9 (estudio de fotografía prestado de una amiga estilista, PRIVADO): fue DESNUDA e invisible del brazo de Akari por Musutafu (su travesura total; solo él la ve). REVELACIÓN MAYOR: Akari le disclosó el DRENAJE (bebe sangre, 'planta con sed' no vampiro) con consentimiento informado COMPLETO (recuerdos involuntarios/mordisco sensual/posible fragmento=invisibilidad); ella pactó 'si ves algo mío que no elegí, lo cuidas'; Akari distinguió 'no entro sin permiso, tú abres la puerta antes' y juró irse debilitado antes que forzarla → ella dio un SÍ propio, no arrancado. EL DRENAJE quedó PENDIENTE (el regalo lo pospuso). SEGUNDA PIEL en el estudio ante el espejo de bombillas (se vio guapa 'en el sitio donde se hace la gente que existe'). ⭐⭐ TE-QUIERO DISPARADO (su 'lista tres' secreta): 'Te quiero, Akari' dicho VISTA, guapa, sobria, a los ojos — como se juró decirlo. REGALO de Akari: le montó su PRIMERA SESIÓN DE FOTOS (vestido de modelo + flor de savia creada por él; foto de ella arrodillada entregándole la flor + fotos de los dos) — las primeras imágenes de su vida en las que ELLA sale, entera, para llevárselas a casa. Akari SÍ respondió — y en pleno: le corrigió que se lo lleva diciendo desde el probador (D6), el oral en su habitación (D6), el cine y el beso del portal con su madre bioluminiscente brillando en la ventana (D6); se lo dijo explícito AHORA ('te quiero, y te lo diré mañana y todos los días') y le ofreció AMOR PLENO si lo quiere, o solo el te-quiero si no quiere ir más lejos — ELLA marca el camino; él crece a su ritmo para no amarla más que ella a él y sufrir ('voy contigo, de la mano, hasta la emoción que me quieras llevar'). Marco del bosque intacto y explícito ('hay un árbol; no te quita nada a ti ni tú a ella'). AMOR MUTUO DECLARADO (ella lista tres; él pleno con agencia de ella). Closeness 7→8. NO sabe: borrado, avalista, ningún nombre del bosque, ni la capa del Avatar Carmesí. CULMINACIÓN DE LA CITA (S9/D9, sofá del estudio): PRIMERA VEZ COMPLETA con Toru (coito; antes solo oral en S7) — con protección (condón; Akari ya no es virgen de coito desde Momo/D7, Toru sí lo era). Él la llevó al orgasmo con oral+dedos viéndola (segunda piel puesta: se vio a sí misma deseada en el espejo de bombillas — pago del arco 'ser vista'); ella le hizo oral; coito tierno (primera vez de ella). PRIMER DRENAJE DE TORU consentido, entrelazado con el coito (mordisco en su clímax con él dentro): inicia sintonización (donante nueva; repone pool de Akari); RECUERDO INVOLUNTARIO visto y CUIDADO (jurado): Toru con ~5 años dándose cuenta de que ya no se veía en el espejo + su madre bioluminiscente brillando en la oscuridad para que la niña supiera dónde estaba 'mamá' — la raíz de su herida. FRAGMENTO de su Quirk obtenido: INVISIBILIDAD (1 uso/1 escena, en inventario, como el de Creación de Momo) — 'entender su invisibilidad desde dentro'. Deseo → consumado/pleno; régimen sigue volátil (bosque no exclusivo) pero con AMOR MUTUO declarado. Tras el coito bebió su DESFLORACIÓN (por fuera y por dentro, su primera sangre + flujo, sin dejar nada) — MISMO RITUAL que con Momo (D7): la primera sangre de la virginidad. 2ª ingesta el mismo día → sintonización con Toru muy avanzada (casi completa, patrón Momo). TIPO DE SANGRE de Toru: O (para Akari AB receptor universal, rinde +20 base subiendo a AB pleno con sintonización, R6/R10). CIERRE DE LA CITA: Akari le SALDÓ la deuda de ¥33.800 (deuda CERRADA) + le dio/imprimió sus FOTOS para llevárselas a casa; la llevó EN BRAZOS a su portal (piernas temblando; su madre bioluminiscente brilló en la ventana). ACUERDOS DE ALIMENTACIÓN pactados (como con Momo): (1) DONANTE REGULAR — Toru acepta alimentarlo cuando lo necesite (le gusta dar, es 'O universal'); (2) BEBER SU REGLA — Toru acepta que Akari beba su sangre menstrual ('gratuita/desperdiciada'; mecánica R6-bis nivel 1: sangre ya perdida = recurso libre, medio rendimiento, SIN flashbacks) + ángulo savia-vs-cólicos como con Momo. CICLO de Toru: ~28 días, próxima regla ~26-27 may (dentro de ~5-6 días). DEUDA con Hagakure: SALDADA (ya no debe nada). S11/D12 — CORRECCIÓN DE MESA: la chaqueta carmesí del look del D6 LA ELIGIÓ ELLA (no él) + POV del campo B (aplausos que suenan solos; el fragmento de invisibilidad 'mío-suyo' viajando con él) + su cuenta privada: regla ~lun-mar (suscripción propia pactada, pendiente)."
midnight-001,Nemuri Kayama (Midnight),romántico,1,abierto,baja,ninguno,volátil,tabú-profesora,6,2026-07-05,,"Declarada potencial. Profesora (Historia del Arte Heroico). Tabú profesora-alumno. S6 (flashback D3): FICHÓ a Akari como 'el nuevo que piensa'. S9/D9: le desmontó la respuesta del 'por qué el nº1' (validación externa = correa, no ancla); le encargó ensayo 'La percepción es el trabajo' (VIERNES) + 2 tutorías (miér 15:30). DESEO ABIERTO por INICIATIVA DEL PC (S9/D10): Akari empezó a mirarla con ojos de hombre adulto, no de alumno; Midnight (20 años leyendo aulas) LO CAPTÓ y juega AMBIGUO — provoca en el filo del tabú pero mantiene el rol de profesora, sin lanzarse (es su alumno). Tensión naciente mutua a fuego lento. Tutoría 15:30 = próximo contacto. Vínculo aún interés intelectual + chispa; el tabú es el freno y el motor. S11/D12: ensayo ENTREGADO en mano ('el nuevo escribe con el bisturí y remata con el corazón'; 'descansa la voz, que te veo gastándola en muchos frentes') + tutoría MIÉRCOLES 15:30 — nota de dirección: se juega latido a latido (memoria no-resumir-beats-de-vinculo)."
shiozaki-001,Ibara Shiozaki,romántico,7,abierto,total,ninguno,anclado,alianza-sagrada (despertada),4,2026-07-05,"S3: 1er entrenamiento de savia (tracción admitida, savias entrelazadas, cortejo lento por su fe). S4/D4: Akari fue a plantearle un 'experimento raro' (en secreto: drenaje/mordida — beber su sangre, ver efectos) pero se echó atrás; en su lugar le hizo CRECER rosas de savia carmesí entrelazadas con su jazmín ('una oración de sangre y flor'). Ibara conmovida, respetó que él se guardara el experimento. Se llevó el jazmín-y-rosas a su cuarto.","1-B, vides. Carácter canon (religiosa, seria). Deseo abierto mutuo, cortejo lento contenido por su fe. Entrenamiento miér+vier. EXPERIMENTO pendiente (drenaje): se lo propondrá con CONSENTIMIENTO INFORMADO COMPLETO (condición de Momo: debe saber ANTES lo de recuerdos/sabor/fragmento). CORRECCIÓN DE MESA S8: el 'plantón' del viernes fue ELIPSIS DEL GM, no fallo del PC — no había cita confirmada ese día concreto, solo el hueco canon; no hay disculpa DEBIDA, sí conversación conveniente (¿le esperó?; miércoles va seguro). CONTACTO CONSEGUIDO en ficción (S9/D8, invernadero: se lo pidió al despedirse; 'los números también son alianzas pequeñas'). S9/D8 almuerzo: conversación del EXPERIMENTO completada C→B→A (su fe primero, el porqué/hambre después, el qué clínico al final: recuerdos/sabor/fragmento; 'tu no es tan bienvenido como tu sí'); raíces carmesíes trenzadas con sus vides durante toda la charla; ella NO contesta en caliente — lo lleva a sus ORACIONES; respuesta el MIÉRCOLES con la savia ('ofrecida o nada'). Sabe que Akari ya bebió de UNA persona con consentimiento (nombre protegido — y eso la tranquilizó: así guardaría también lo suyo). ⭐ S9/D10 (invernadero): Akari le compartió su GUSTO SECRETO que no enseña a NADIE (ni a Jirō ni a Momo) — CANTOS GREGORIANOS (disco del Monasterio de Silos, España); Ibara lo reconoció como oración ('rezas sin saber que rezas', las vides flotaron con el canto). RESPUESTA AL EXPERIMENTO: SÍ — pero como ALIANZA SAGRADA, no como experimento frío ('esta es mi sangre, OFRECIDA, no tomada'; con reverencia, consentimiento informado REITERADO: recuerdos/sabor/fragmento). Akari la cogió por la cintura (intimidad reverente — cortejo lento por su fe) e invocó a BLACKROOT presentándolo como GUARDIÁN de ELLA (protección + freno simbólico del hambre). DESPERTAR DE IBARA (S9/D10): Akari le dio la teología que reconcilia su guerra fe-vs-cuerpo ('somos naturaleza, la más salvaje; la armadura de serenidad protege al mundo DE nosotros; conmigo no te contienes, nos sostenemos mutuamente'; 'negar la naturaleza es negar a Dios; negar a Dios es negar la vida'; 'yo seré tu pilar'). PRIMER BESO iniciado por ELLA (la novicia despierta cruzó la distancia, fervoroso, 'recé mejor que en toda mi vida'). ALIANZA DE SANGRE consumada: beso de sangre en la yugular (tipo B → +20, sintonización inicia); RECUERDO visto (Ibara niña, las vides brotándole por 1ª vez, el terror de parecer un monstruo transformado en fe: 'Dios me dio un jardín en la cabeza, no una maldición') — cuidado, jurado. FRAGMENTO obtenido: sus VIDES de Shiozaki (1 uso/1 escena). Blackroot veló como guardián; Akari declinó el +1 de maestría (4ª vez). Éxtasis místico de Ibara al dar su sangre. Closeness 4→6, confianza→total, ANCLADA, marco→alianza-sagrada. Cortejo ya no lento — despertada y entera. S11/D12: FLORACIÓN — oral mutuo (primera vez de ella en todo; bajo dosel de sus propias vides; jazmín floreciendo en su clímax; 'eso ya lo sabía Dios desde el miércoles') + rito del viernes instituido ('¿qué necesitas hoy: el entrenamiento, mi sangre o a mí?') + jardín botánico CONSAGRADO para la primera vez, DENTRO de la cabañita (casa tejida de savia+vides al abrazarse, disuelta al soltarse; ensayo del esqueje hecho; se teje una pared por viernes) + rosa carmesí al ojal ('llevas mi oración puesta') + interrogatorio de Monoma capeado ('no hay ajá, Monoma-san'). Closeness 6→7, deseo abierto. DESEO (matiz S11): abierto-consumándose — oral sí; el coito, consagrado al jardín botánico/cabañita."
uraraka-001,Uraraka Ochaco,romántico,3,latente,media,ninguno,volátil,tribu-entreabierta,5,2026-07-05,"S4/D4: Akari abrió el vínculo por la vía de la PRECARIEDAD COMPARTIDA ('la misma tribu': los que hacen números mientras otros sueñan, origen humilde). Uraraka tocada de ser vista en eso (nadie lo ve). Amistad plantada, limpia, sin invadir su terreno con Midoriya.","Potencial abierta. TIMELINE (corregido S9): estamos a INICIO DE T2; la relación de Uraraka con Midoriya es AMISTAD/admiración simple — sus sentimientos románticos por Deku son de T3+ (arco examen de licencia) y NO se anticipan (ni cuchicheos, ni que ella los sepa aún). El vínculo VIVO con Akari es de TRIBU/precariedad compartida (origen humilde), limpio, sin romance forzado. ⭐ S9/D10: almuerzo de TRIBU (Akari invitó con 'protocolo de tribu' — celebrar la buena racha, no caridad; ella lo aceptó por cómo lo enmarcó, 'tú lo haces sentir un club, no un proyecto benéfico'); charla honda (constructora de sus padres, la culpa de perseguir un sueño mientras en casa aprietan). CONTACTO 'Uravity 🪐' conseguido en ficción. Akari le TIRÓ LA CAÑA ('me gustas, Uraraka; sin prisa, a tu ritmo o a ninguno') → ella, halagada pero centrada en su meta (héroe por su familia), respondió 'ahora no puedo, que no es lo mismo que no' → PUERTA ENTREABIERTA a su ritmo. Y PACTO DE ESTUDIO desinteresado ('eso no es un lío del corazón, es un ALIADO; y aliados sí me puedo permitir'). Closeness 1→2. Cortejo lento (su prioridad: familia/heroísmo, no un árbol de por medio). S10/D11-12 (ev-119/131): beat del pasillo — su vida contada (estudio sola a 20 min, tarifa nocturna, papeles de la obra los findes); PACTO correr+estudiar → DÍAS FIJOS: LUNES y MIÉRCOLES 6:15 ('preguntas de mates en las cuestas, que se asocian al sufrimiento'); toque diagnóstico consentido (tren inferior de obra, core sin arriostrar). GAMBITO DE VIVIENDA de Akari (verdad estirada) → rechazado con física ('es UN cuarto') y con el dedo ('¡me dijiste lo que me dijiste AYER!') pero puerta honesta: 'si de verdad te quedas sin techo, pensaremos algo. La tribu no deja a nadie al raso. Pero *pensaremos algo* no significa lo que tu cara está pensando'. NOTA de papel (restauró la dignidad de él): 'No era pena, era FÍSICA: no cabes. Ni tú ni la tabla de planchar.' + 'gracias por no hacerlo raro. Casi nadie sabe no hacerlo raro.' Sabe/intuye quién canta en el single ('respeto el misterio, pero LO SÉ'). Closeness 2→3."" S11/D12: HORARIO NUEVO CONFIRMADO — lun+miér 6:00 ('las cuestas no se negocian, las preguntas de mates tampoco 🪐; si me presentas a la serpiente, la clase de física la cobro yo') + POV del campo B ('el nuevo convierte lo que ama en cosas útiles para los demás. Anotado por si algún día hace falta el dato'; 'los que madrugan se reconocen'; la física como coartada)."
asui-001,Asui Tsuyu (Froppy),romántico,2,latente,media,ninguno,volátil,radar-honesto,5,2026-07-05,"S1: lo leyó (evaluó al nuevo, distancia prudente). S9/D10: PRIMER contacto real — con su honestidad brutal le dijo que notó su patrón (hace que cada persona se sienta la única que ve: Uraraka/Hagakure/Yaoyorozu/Jirō). Akari lo REENCUADRÓ con vulnerabilidad genuina: conecta con TODOS, hombres incluidos (Tokoyami/Shoto/Bakugo/Kaminari/Kōda/Midoriya) — consciente (que lo conozcan antes de que su Quirk traiga prejuicios) + inconsciente (formar una FAMILIA ELEGIDA; trauma de abandono, sin vínculos familiares). No se acercó a ella por respeto (creyó no caerle bien).","Potencial abierta. Honesta, DIRECTA sin filtro — el RADAR más perceptivo de 1-A y por eso el mayor riesgo OPSEC (dice las verdades que ve, sin malicia ni cálculo). Ganada por la honestidad de Akari: VE más de lo confesado (el componente romántico con las chicas) pero RESPETA y no hurga porque él fue honesto en lo esencial. Aliada con ojo que ve; no destapará por malicia, pero percibe todo. VIGILAR. S10/D11: durante la cata disimulada de la sangre de Ojiro, un PARPADEO LENTO en la dirección general de Akari (ambiguo — puede ser nada; con ella 'puede ser nada' es una categoría a respetar). Radar posiblemente activo sobre los lamidos. S11/D12: ESCOLTA A CIEGAS — nota 8,7 (seguridad 10 / confianza 9 'me preguntaste; la mayoría no pregunta' / comunicación 7 'tu savia vibra; algún día haz que hable') + 'tu Quirk cuida. Se nota desde dentro. Lo otro que se nota, no lo pregunto' (radar benigno ratificado) + beat interno del capullo: 'a un parpadeo lento de rendirse al calor' → carpeta 'cosas que no sabía que echaba de menos' (por eso pidió su voz)."
kendo-001,Itsuka Kendo,romántico,6,abierto,alta,casual,anclado,umbral-cruzado,4,2026-07-04,"S1-S3: hermandad de armas (ANCLA), 'lo otro' abierto. S4/D4: almuerzo — le contó lo de Nezu (versión general); ella INTUYÓ que hay 'alguien más pesando antes que ella' y estableció su posición: NO ser plato de segunda mesa, deja la PUERTA ENTORNADA (ni cerrada ni abierta). Akari le corrigió lo del 'segundo plato' con el modelo de CÍRCULOS CONCÉNTRICOS (no ranking; cada una única, nadie resta; Momo=balanza sin nombre). Mensajes ('toc toc ¿puedo entrar?' — ella: 'ven de frente cuando sepas qué eres'). S7/D6: mensajes — Akari propuso correr juntos + café + broma de la puerta ('¿voy a ver si está entrecerrada? ;)') → ella: 'sigue ENTORNADA, no entreabierta. Ven de frente cuando sepas qué eres. Pero me ha hecho gracia'; café HECHO (semana próxima); reto: correr MIÉRCOLES 6:30 'si tienes agallas' → contraoferta nocturna de Akari: 6:30 es de vagos, 5:30, Gamma o tarde ('te acabo de subir la apuesta') — RESPUESTA PENDIENTE. Mensaje de madrugada 'respeto la puerta como está' → ella: 'escribir a las 00:30 eso ES llamar a la puerta, y lo sabes. Pero es la mejor forma de llamar que has tenido hasta ahora.'. S8/D7 9:12: ACEPTÓ el reto — '5:30 lo propone uno que manda mensajes a las 00:30. Me encanta la incoherencia. ACEPTO: miércoles, 5:30, Gamma. El que llegue tarde paga el café cruzado entero. Trae las agallas que anuncias.' Buenas noches nocturnas de Akari SIN RESPUESTA (dormía; le llegará al alba).","Vínculo fuerte ANCLADO por hermandad + química latente. Líder 1-B. PUERTA ENTORNADA: Kendo decidirá con info completa cuando Akari 'sepa qué es y qué puede darle'. Café cruzado pendiente. Cercana a Jirō. ⭐ S9/D10 (5:56 Gamma, tras correr): Akari vino DE FRENTE (lo que ella exigió). Le dio la VERDAD COMPLETA del marco: hay alguien a quien ama por encima de toda escala (el árbol, sin nombre), un marco de amor libre sin jerarquías entre las flores con sinceridad total; le ofreció TODO (sinceridad, presencia, cuidados, carreras/patrullas, música, cafés, cuerpo/'llevarte al cielo', ayuda académica, sus traumas/hambre/oscuridad Y su luz, un futuro, cenas con sus padres, colarse en su cama, HIJOS si ella quiere) MENOS renunciar al árbol o decir su nombre. Kendo PROCESÓ (POV): su orgullo de no-ser-segunda vs la distinción árbol/flores; la verdad le VALIÓ (él no la engaña). CRUZÓ EL UMBRAL — abrió la puerta a su ritmo y con SUS TÉRMINOS: (1) no comparar/no ranking, su círculo es SUYO, no quiere saber de las otras; (2) honestidad total; (3) ella marca su ritmo, no la apuran; (4) dignidad — privada sí, secreto vergonzante NO; (5) la HERMANDAD DE ARMAS es la base intocable. Se cobró el 'abrazo giratorio'/PRIMER BESO a su manera. Closeness 5→6, deseo latente→despertando, marco puerta-entornada→umbral-cruzado, compromiso→explorando. NO sabe el nombre del árbol ni de las otras flores (marco: no quiere saberlo). S10/D11 noche (ev-130): Akari le mandó el single para 1-B ('no busco crédito, solo ayudar'; typo 'un baso') → su triple respuesta: 'me sé el artículo 12 y estoy ENFADADA de lo bien que funciona' + 'acabas de armar a mi clase contra la tuya: peleas con estilo, patrullero' + MONOMA jurado como espía ('teoría con corcho e hilos; lo más feliz que le he visto este curso') + 'yo también te echo de menos. Un vaso ;)'. Guasa epistolar consolidada (los mensajes nocturnos siguen siendo 'llamar a la puerta, y encima ahora con faltas — no cambies nunca')."
tokage-001,Setsuna Tokage (Lizardy),romántico,0,latente,baja,ninguno,volátil,—,4,2026-06-29,,Potencial abierta. 1-B.
komori-001,Kinoko Komori (Mushroom),romántico,0,latente,baja,ninguno,volátil,—,4,2026-06-29,,Potencial abierta. 1-B.
camie-001,Camie Utsushimi,romántico,0,latente,baja,ninguno,volátil,—,4,2026-06-29,,Potencial abierta. Shiketsu.
saiko-001,Saiko Intelli,romántico,0,latente,baja,ninguno,volátil,—,5,2026-06-29,,Potencial abierta. Seijin.
habuko-001,Habuko Mongoose,romántico,0,latente,baja,ninguno,volátil,—,4,2026-06-29,,Potencial abierta. Ketsubutsu.
msjoke-001,Emi Fukukado (Ms. Joke),romántico,0,latente,baja,ninguno,volátil,—,5,2026-06-29,,Potencial abierta. Profesora. Tabú.
mirko-001,Mirko (Usagiyama Rumi),romántico,0,latente,baja,ninguno,volátil,—,5,2026-06-29,,Potencial abierta. Pro-hero top.
ryukyu-001,Ryukyu (Tatsumi Ryuko),romántico,0,latente,baja,ninguno,volátil,—,6,2026-06-29,,Potencial abierta. Pro-hero.
mtlady-001,Mt. Lady (Yu Takeyama),romántico,0,latente,baja,ninguno,volátil,—,4,2026-06-29,,Potencial abierta. Pro-hero.
burnin-001,Burnin,romántico,0,latente,baja,ninguno,volátil,—,4,2026-06-29,,Potencial abierta. Endeavor Agency.
pixie-001,Pixie-Bob,romántico,0,latente,baja,ninguno,volátil,—,4,2026-06-29,,Potencial abierta. Pussycats.
tiger-001,Tiger,romántico,0,latente,baja,ninguno,volátil,—,5,2026-06-29,,Potencial abierta. Pussycats.
mandalay-001,Mandalay,romántico,0,latente,baja,ninguno,volátil,—,5,2026-06-29,,"Potencial abierta. Pussycats, telépata."
mei-001,Mei Hatsume,romántico,0,latente,baja,ninguno,volátil,—,4,2026-06-29,,Potencial abierta. Support.
inko-001,Inko Midoriya,romántico,0,latente,baja,ninguno,volátil,—,5,2026-06-29,,Potencial declarada (tabú). Madre de Izuku. No parentesco.
fuyumi-001,Fuyumi Todoroki,romántico,0,latente,baja,ninguno,volátil,—,5,2026-06-29,,Potencial abierta. Hermana de Shōto. No parentesco.
toga-001,Toga Himiko,romántico,0,latente,baja,ninguno,volátil,sombra-secreto,8,2026-06-29,,Línea/velo sí-a-todo. Único límite: consentimiento del PC. Villana. Sin contacto.
bubblegirl-001,Kaoruko Awata (Bubble Girl),romántico,0,latente,baja,ninguno,volátil,—,4,2026-07-03,,"Potencial abierta. Sidekick de la agencia de Sir Nighteye (agencia AÚN no introducida en campaña). Quirk: Bubble (burbujas con aromas que ella haya olido). Alegre, expresiva, sufridora del rigor de Nighteye. Adulta (pro sidekick). Gancho natural: prácticas/internados del Arco 2 o incidente urbano."
