id,rasgo_objetivo,tipo,descripcion,requisitos,coste_narrativo,activa
ruta-001,maestria_quirk (control del Eco),operativa,"Entrenamiento con Aizawa. S4: sostiene los 'dos tiempos' limpio (M4 consolidado). Siguiente: dominar más tiempos / M5 (RALENTIZAR — Aizawa avisó del ritmo).","6:30 mañanas en Gamma.","Miedo, scars, madrugones; y ahora el techo de la curva.",si
ruta-002,maestria_quirk / TEC_quirk (control de savia),segura,"Entrenamiento con Ibara (escuchar la savia). Miér+vier.","Miér y vier tras clase; marco 'a la luz'.","Paciencia; gestionar la tracción.",si
ruta-003,COO / liderazgo,operativa,"Coordinación (Kendo) + liderazgo social (fundó la mesa de los guardianes, ganó a Iida, tejió comunidad). Marca fuerte acumulada.","Tiempo con la red; aplicar en equipo.","Exposición; gestión del harem.",si
ruta-004,ING / académico,segura,"Recuperar el temario (2/3 comido). Mates dominado. Exámenes en ~2 semanas.","Estudio; apuntes de Momo/Kendo/Iida.","Tiempo.",si
ruta-005,recuperación en combate / drenaje AB (poquito de muchas),brutal,"Rellenar el pool en marcha (drenaje enemigo en pelea limpia / donación consentida / gestión propia). S5: ACTIVADA — Aizawa la avala con línea roja sellada ('recibir, no tomar'); Akari es AB (receptor universal), su sangre en otros crea vínculo simbiótico/curación, no sumisión. Empezar disciplinado; experimento con Ibara pendiente.","Línea roja anti-Drácula (sellada); consentimiento; leer el propio bidón (ya sabe).","Edge 18+; la savia 'quiere' beber; riesgo de que el hambre mande; efectos de su sangre en otros; que no le guste 'el sabor y no el motivo'.",si
ruta-006,capacidad de pool / acondicionamiento físico,operativa,"S5: ACTIVADA por Aizawa — agrandar el depósito de sangre real por acondicionamiento (volumen, riego, médula, hierro en dieta) + curación a terceros (M4 ya la permite: vines medicinales, coste 10/herida). Crece SIN subir maestría (no enciende la bengala). Ligada a PWR/stamina, madura por arco.","Series brutales 06:30; dieta rica en hierro; constancia diaria.","Sudor; el techo es lento (semanas/arco), no un atajo.",si
