id,rasgo_objetivo,tipo,descripcion,requisitos,coste_narrativo,activa
ruta-001,maestria_quirk (control del Eco),operativa,"Entrenamiento con Aizawa. S4: sostiene los 'dos tiempos' limpio (M4 consolidado). Siguiente: dominar más tiempos / M5 (RALENTIZAR — Aizawa avisó del ritmo).","6:30 mañanas en Gamma.","Miedo, scars, madrugones; y ahora el techo de la curva.",si
ruta-002,maestria_quirk / TEC_quirk (control de savia),segura,"Entrenamiento con Ibara (escuchar la savia). Miér+vier.","Miér y vier tras clase; marco 'a la luz'.","Paciencia; gestionar la tracción.",si
ruta-003,COO / liderazgo,operativa,"Coordinación (Kendo) + liderazgo social (fundó la mesa de los guardianes, ganó a Iida, tejió comunidad). Marca fuerte acumulada.","Tiempo con la red; aplicar en equipo.","Exposición; gestión del harem.",si
ruta-004,ING / académico,segura,"Recuperar el temario (2/3 comido). Mates dominado. Exámenes en ~2 semanas.","Estudio; apuntes de Momo/Kendo/Iida.","Tiempo.",si
ruta-005,drenaje / poder de sangre (poquito de muchas),brutal,"Idea de Akari: drenar un poco de cada vínculo (con consentimiento) para regenerar el pool y entrenar/combatir más lejos. Sensual, íntimo, con sombra de Drácula que Akari elige no ser.","Consentimiento de los vínculos; empezar con Ibara (experimento pendiente).","Edge 18+; la savia 'quiere' beber; riesgo de que el hambre mande; efectos de su sangre en otros.",no
